{"ir_version":"1.0.0","id":"run:full","nodes":[{"id":"n1","kind":"start"},{"id":"n2","kind":"task"}],"rules":[{"id":"r1","when":"(initial-fact)"},{"id":"r2","when":"?x <- (foo (bar ?b))"}],"tools":[{"id":"t.search","version":"1.0.0"},{"id":"t.fetch"}],"skills":[{"id":"s.read"},{"id":"s.write","version":"2.1.0"}],"stores":[{"name":"kv","provider":"memory"},{"name":"blob","provider":"s3"}],"state_schema":{"count":"int","name":"str"},"parallel":[{"targets":["n1","n2"],"join":"gather","strategy":"quorum"}],"governance":[{"id":"p.guard"},{"id":"p.audit","version":"1.2.3"}],"migrate":[{"from_hash":"abc123","to_hash":"def456"}]}